{
  "schemaVersion": "HA-spatial-draft-layer-v1",
  "syntheticFixture": false,
  "sourceContextVersion": "T13-attachment-context-v2",
  "records": [
    {
      "id": "T13C-B03-HA-A-T05-TA-TIBIA-SURFACE-ORIGIN",
      "status": "context_only",
      "attachmentId": "HA-A-T05-TA-TIBIA-SURFACE-ORIGIN",
      "descriptionClaimId": "HA-C-T05-TA-TIBIA-SURFACE-ORIGIN",
      "sourceClaimHash": "53c8cf3aa8518dbf44410c8a24c0a11259acd39eb8b68d40dc60b3d3feaaf8e5",
      "instanceId": "HA-I-R-HA-M-000003",
      "side": "right",
      "assetId": "HA-MESH-BP3D4-FJ3387",
      "assetRevision": "BP3D-R4-OBJ-TO-GLB-V1",
      "assetRevisionHash": "044450c3230bd23869a099d545151cb3d7518da3240a6e59f911f82786edc341",
      "topologyHash": "1a44d95c1a84f014cce9452a7185814ec3c416efe3781e05bd223650c3c26f38",
      "geometry": null,
      "frameId": "HUMAN_ATLAS_RH_M_XLEFT_YHEAD_ZANTERIOR",
      "units": "m",
      "poseId": "bodyparts3d-r4-static-reference",
      "precision": null,
      "method": null,
      "evidenceIds": [
        "EV-GRAY1918-TIBIALIS-ANTERIOR"
      ],
      "reviewId": null,
      "staleReason": null,
      "migrationSource": "atlas-data/manifests/attachment-context-t13.json#records/HA-A-T05-TA-TIBIA-SURFACE-ORIGIN"
    }
  ]
}
